{
  "triage_recommendation": "not_decision_ready",
  "trust_signal": "unknown",
  "decision_readiness_score": 32,
  "decision_readiness_label": "not_decision_ready",
  "actor": {
    "declared_type": "api_client",
    "declared_name": "Partner Export Client",
    "operator": "Example Partner Ltd",
    "authentication_context": "api_key"
  },
  "target_surface": "api",
  "requested_action": "export recent account activity for delegated analytics",
  "supplied_sources": [
    "session_authentication_evidence",
    "transaction_or_target_action_evidence",
    "prior_interaction_history"
  ],
  "minimum_sources_before_action": [
    "agent_identity_claim",
    "operator_or_principal_authorization",
    "agent_card_or_manifest",
    "tool_scope_or_permission_evidence",
    "action_intent_evidence"
  ],
  "evidence_gaps": [
    "No agent identity claim supplied.",
    "No operator or principal authorization supplied.",
    "No agent card or signed manifest supplied.",
    "No tool-scope or permission evidence supplied.",
    "No action-intent evidence supplied."
  ],
  "top_risk_dimensions": [
    "delegated action authority is not evidenced",
    "agent identity is declared but not independently anchored",
    "requested tool or action scope is not evidenced",
    "action intent is not evidenced"
  ],
  "watch_next": [
    "agent identity spoofing pattern",
    "unexpected tool-scope expansion",
    "checkout or transaction anomaly",
    "account takeover signal",
    "rate-limit or scraping burst",
    "provider allowlist or policy change",
    "mcp or a2a endpoint metadata change",
    "credential leakage or secret exposure report"
  ],
  "human_review_required": true,
  "not_advice_notice": "Agentic interaction evidence triage only. Not cybersecurity monitoring, fraud adjudication, identity verification, transaction authorization, legal advice, compliance advice, or financial advice.",
  "limitations": [
    "This response does not verify the identity of the actor, operator, or principal.",
    "This response does not authorize, approve, deny, or block the requested action."
  ],
  "asset_or_resource": "accounts/activity/export",
  "source_record_review": {
    "policy_version": "source-records.v1",
    "scope": "reference_metadata_only",
    "source_content_verified": false,
    "freshness_verified": false,
    "usable_source_types": [
      "session_authentication_evidence",
      "transaction_or_target_action_evidence",
      "prior_interaction_history"
    ],
    "issues": [],
    "next_action": "Verify source content, issuer, recency and relevance before relying on this reference coverage."
  },
  "readiness_contract": {
    "profile": "agentic_interaction_trust",
    "status": "not_decision_ready",
    "score": 32,
    "routing": {
      "field": "triage_recommendation",
      "value": "not_decision_ready"
    },
    "signal": {
      "field": "trust_signal",
      "value": "unknown"
    },
    "blocking_gaps": [
      "No agent identity claim supplied.",
      "No operator or principal authorization supplied.",
      "No agent card or signed manifest supplied.",
      "No tool-scope or permission evidence supplied.",
      "No action-intent evidence supplied."
    ],
    "non_blocking_gaps": [],
    "claim_audit": [],
    "owner_actions": [],
    "watch_next": [
      "agent identity spoofing pattern",
      "unexpected tool-scope expansion",
      "checkout or transaction anomaly",
      "account takeover signal",
      "rate-limit or scraping burst",
      "provider allowlist or policy change",
      "mcp or a2a endpoint metadata change",
      "credential leakage or secret exposure report"
    ],
    "human_review_required": true,
    "boundary_notice": "Agentic interaction evidence triage only. Not cybersecurity monitoring, fraud adjudication, identity verification, transaction authorization, legal advice, compliance advice, or financial advice."
  },
  "next_action": "insufficient",
  "decision_kind": "evidence_review",
  "authorization_granted": false,
  "score_kind": "evidence_readiness"
}
